,Title,Company,Location,Job Description,When Posted,Pay,City,State,Is_Hybrid_Remote
198,"(Open Rank) Assistant, Associate, Full Professor of Industrial and Systems Engineering",USC,"Los Angeles, CA",Candidates at the senior ranks must have demonstrated research excellence and sustained commitment to the discipline and are expected to have a vibrant research…,Posted 30+ days ago·,,Los Angeles,CA,False
199,"Manager, Machine Learning",Numerade,"Remote in Los Angeles, CA",Experience with data warehouses and data lakes.,Posted 30+ days ago·,,Remote in Los Angeles,CA,True
200,Consultant Artificial Intelligence / Machine Learning Engineer (AI/ML),Specular Theory,"Venice, CA",Help leverage our in-house technology and ensure our system can also communicate and utilize existing AI/ML systems.,Posted 30+ days ago·,,Venice,CA,False
201,"Staff Machine Learning Engineer, Public Company",Recruiting From Scratch,"Torrance, CA","Collect, analyze, and synthesize findings from data and build intelligent data-driven model.",Posted 25 days ago·,220000.0,Torrance,CA,False
202,"Staff Data Scientist, Advanced Analytics and Engineering",Match Group,"Hybrid remote in West Hollywood, CA","The ideal candidate will have the right mix of hard and soft skills that allows them to technically mentor data scientists, while also effectively communicating…",Posted 30+ days ago·,220000.0,Hybrid remote in West Hollywood,CA,True
203,Senior Process Engineer (Advanced R&D),Freeform,"Los Angeles, CA",Experience with machine learning or data science.,Posted 17 days ago·,200000.0,Los Angeles,CA,False
204,Research & Litigation Services Attorney – Artificial Intelligence,Latham & Watkins LLP,"Los Angeles, CA 90013 ",The Research & Litigation Services Attorney – Artificial Intelligence (AI Attorney) is an integral part of Latham’s Litigation Services team.,Posted 1 day ago·,180000.0,Los Angeles,CA,False
205,Senior Product Manager,Sidecar Health,"Remote in Los Angeles, CA","Bachelor's or master's degree in computer science, data science, information systems, business administration, or a related field.",Posted 30+ days ago·,,Remote in Los Angeles,CA,True
206,"Sr. Specialist, Advanced Analytics",DIRECTV,"Remote in El Segundo, CA","3 - 5 years of related experience in data science, advanced analytics, and machine learning.",Posted 8 days ago·,,Remote in El Segundo,CA,True
207,"Sr Product Manager I, Data Solutions & Instrumentation (ESPN Fantasy)",Disney Entertainment & ESPN Technology,"Santa Monica, CA","Advanced degree in computer science, information systems, software, or data science.",Posted 30+ days ago·,182490.0,Santa Monica,CA,False
208,Senior Data Architect,USC,"Los Angeles, CA","8 years in information technology, big data, data science, analytics platforms and/or higher education.",Posted 30+ days ago·,170000.0,Los Angeles,CA,False
209,Analytics and Visualization Data Scientist,Booz Allen,"El Segundo, CA","2+ years of experience with data exploration, data cleaning, data analysis, data visualization, or data mining.",Posted 14 days ago·,166000.0,El Segundo,CA,False
210,Sr. Bioinformatician - Jonsson Cancer Center,UCLA Health,"Los Angeles, CA 90095",Four years’ biological and data science experience.,Posted 30+ days ago·,,Los Angeles,CA,False
211,Charge Capture Coordinator - Clinical Revenue Integrity,Keck Medical Center of USC,"Alhambra, CA",Req Must have excellent data entry and quality outcome skills.,Posted 14 days ago·,94016.0,Alhambra,CA,False
212,Data Cloud Solutions Consultant,Zeta Global,"El Segundo, CA",Comprehensive understanding of data-driven marketing and analytics.,Posted 2 days ago·,100000.0,El Segundo,CA,False
213,Senior Electrical Design Engineer,BOEING,"Hybrid remote in Long Beach, CA","Collect, organize, synthesize, and analyze data; summarize findings; develop conclusions and recommendations from appropriate data sources.",Posted 2 days ago·,173650.0,Hybrid remote in Long Beach,CA,True
214,Claims Research/ Data Analyst Sr (EDI/Edifecs),Molina Healthcare,"Long Beach, CA 90802",Validates data received on claims to identify billing issues that will impact claims processing and payment.,Posted 30+ days ago·,129589.63,Long Beach,CA,False
215,"Director, Inventory & Yield Management",GoodRx,"Santa Monica, CA 90401 ",4+ years experience in quantitative or data analysis/data science.,Posted 30+ days ago·,279000.0,Santa Monica,CA,False
216,"Director, Analytics - Creator (Customer) Insights",Spotter,"Los Angeles, CA",Ability to troubleshoot data-related issues.,Posted 17 days ago·,500000.0,Los Angeles,CA,False
217,"Data Scientist 2, Marketing Optimization Analytics",Nordstrom Inc,"Los Angeles, CA",“LOVE” the engineering and architecture portion of data science work gain satisfaction in deploying useful data products that make business impact.,Posted 3 days ago·,187500.0,Los Angeles,CA,False
218,Programmer/Analyst (Research Software Engineer) - Slomka Lab - Artificial Intelligence in Medicine (AIM) Program,CEDARS-SINAI,"Los Angeles, CA","Develops software methods for deep learning analysis and segmentation of image data, and data reconstruction.",Posted 30+ days ago·,137300.0,Los Angeles,CA,False
219,Lead Hardware Reliability Engineer (Starlink Product),SpaceX,"Hawthorne, CA","Professional experience in analytics, data science, or machine learning.",Posted 24 days ago·,175000.0,Hawthorne,CA,False
220,Principal AM Process Development Engineer,Divergent 3D,"Torrance, CA",7)Assure proper formulation and design of experiments and thorough documentation of technical data generated for the assigned projects and / or tasks consistent…,Posted 30+ days ago·,210000.0,Torrance,CA,False
221,Master of Applied Statistics and Data Science Lecturer - Spring 2024,UCLA,"Los Angeles, CA","Ideal candidates will have a Ph.D. in Statistics (or a related field) or relevant industry experience, a demonstrated excellence in teaching, knowledge of and…",Posted 21 days ago·,109516.0,Los Angeles,CA,False
222,"Scientific Data Analyst, Sr. / Heart Institute Research",Children's Hospital Los Angeles,"Los Angeles, CA",To establish and support a data server and facilitate web-based user access to data.,Posted 30+ days ago·,,Los Angeles,CA,False
223,Data/GIS Analyst - Advanced Analytics Specialist,Hazen and Sawyer,"Los Angeles, CA 90017","Proficiency in database development, data analytics, and data models.",Posted 30+ days ago·,85000.0,Los Angeles,CA,False
224,Chief AI Officer,Proper Hospitality,"Los Angeles, CA","Oversee the build-out of AI infrastructure and data pipelines, leveraging guest data, property management systems (PMS), and other hospitality-specific data…",Today·,250000.0,Los Angeles,CA,False
